{
  "$schema": "https://json-schema.org/draft/2020-12/schema",
  "$id": "https://schemas.sigill.ai/ai-evidence-envelope/v1.json",
  "title": "AiEvidenceEnvelopeV1",
  "description": "Tamper-evident evidence envelope for an AI generation call. Designed to be canonicalized (RFC 8785 / JCS), hashed, and timestamped (RFC 3161). Sensitive payloads are referenced by hash so the envelope itself can be retained without retaining PII.",
  "type": "object",
  "required": [
    "schemaName",
    "schemaVersion",
    "evidenceId",
    "createdAt",
    "purpose",
    "actor",
    "activity",
    "model",
    "integrity"
  ],
  "additionalProperties": false,
  "properties": {
    "schemaName": {
      "type": "string",
      "const": "AiEvidenceEnvelope",
      "description": "Stable schema identifier. Always 'AiEvidenceEnvelope' for this family."
    },
    "schemaVersion": {
      "type": "string",
      "const": "1",
      "description": "Major version of the envelope schema. Breaking changes increment this."
    },
    "evidenceId": {
      "type": "string",
      "format": "uuid",
      "description": "Stable identifier for this evidence record. Generated by the producer; never reused."
    },
    "createdAt": {
      "type": "string",
      "format": "date-time",
      "description": "ISO 8601 UTC timestamp the envelope was assembled. Distinct from the RFC 3161 genTime in proofs."
    },
    "purpose": {
      "type": "object",
      "additionalProperties": false,
      "required": ["category"],
      "properties": {
        "category": {
          "type": "string",
          "description": "Free-form classifier for why the AI call was made (e.g. 'classification', 'summarization', 'advisory')."
        },
        "businessContext": {
          "type": "string",
          "description": "Short human-readable context (e.g. 'support-ticket-triage')."
        },
        "regulatoryBasis": {
          "type": "array",
          "items": { "type": "string" },
          "description": "Optional list of regulatory frames (e.g. 'EU-AI-Act:Annex-III')."
        }
      }
    },
    "actor": {
      "type": "object",
      "additionalProperties": false,
      "required": ["type", "id"],
      "properties": {
        "type": {
          "type": "string",
          "enum": ["user", "service", "system"],
          "description": "Whether the call was driven by a human user, a backend service, or autonomous system."
        },
        "id": {
          "type": "string",
          "description": "Stable identifier for the actor (e.g. user UUID, service principal). NOT the actor's name or PII."
        },
        "tenantId": {
          "type": "string",
          "description": "Optional tenant the actor belongs to."
        },
        "displayHint": {
          "type": "string",
          "description": "Optional non-PII display hint (e.g. role, department)."
        }
      }
    },
    "activity": {
      "type": "object",
      "additionalProperties": false,
      "required": ["name"],
      "properties": {
        "name": {
          "type": "string",
          "description": "Stable name of the activity (e.g. 'invoice.classify', 'chat.completion')."
        },
        "correlationId": {
          "type": "string",
          "description": "Tracing/correlation id linking this evidence to the parent business transaction."
        },
        "parentEvidenceId": {
          "type": "string",
          "format": "uuid",
          "description": "Optional link to a prior envelope this one continues from."
        }
      }
    },
    "model": {
      "type": "object",
      "additionalProperties": false,
      "required": ["provider", "name"],
      "properties": {
        "provider": {
          "type": "string",
          "description": "AI provider (e.g. 'anthropic', 'openai', 'azure-openai', 'self-hosted')."
        },
        "name": {
          "type": "string",
          "description": "Model identifier as reported by the provider (e.g. 'claude-opus-4-7')."
        },
        "version": {
          "type": "string",
          "description": "Provider-reported model version or build, if any."
        },
        "deploymentId": {
          "type": "string",
          "description": "Optional deployment-specific identifier (e.g. Azure deployment name)."
        },
        "parameters": {
          "type": "object",
          "description": "Sampling parameters used (temperature, top_p, max_tokens, ...). Recorded verbatim."
        }
      }
    },
    "prompt": {
      "$ref": "#/$defs/payloadRef",
      "description": "The prompt as a payload reference (hash + ref) or inline content. Use a reference for PII-bearing prompts."
    },
    "inputs": {
      "type": "array",
      "description": "Additional structured inputs (tools, function arguments, attachments) used by the call.",
      "items": { "$ref": "#/$defs/payloadRef" }
    },
    "retrievedContext": {
      "type": "array",
      "description": "RAG / retrieval-augmented context chunks fed into the model. Each entry SHOULD be a hash reference rather than inline content.",
      "items": {
        "allOf": [
          { "$ref": "#/$defs/payloadRef" },
          {
            "type": "object",
            "properties": {
              "rank": { "type": "integer", "minimum": 0 },
              "score": { "type": "number" },
              "source": { "type": "string", "description": "Source document identifier or URI." }
            }
          }
        ]
      }
    },
    "sourceTrace": {
      "type": "array",
      "description": "Provenance trail: where did the retrieved context originate? Useful for downstream auditability.",
      "items": {
        "type": "object",
        "additionalProperties": false,
        "required": ["sourceId"],
        "properties": {
          "sourceId": { "type": "string" },
          "sourceType": { "type": "string", "description": "e.g. 'kb-article', 'database-row', 'web-page'." },
          "sourceUri": { "type": "string" },
          "snapshotHash": { "$ref": "#/$defs/contentHash" },
          "retrievedAt": { "type": "string", "format": "date-time" }
        }
      }
    },
    "output": {
      "$ref": "#/$defs/payloadRef",
      "description": "The model's response. Use a reference for PII-bearing outputs."
    },
    "outputArtifacts": {
      "type": "array",
      "description": "Generated artifacts beyond the primary output (e.g. structured JSON, generated files).",
      "items": { "$ref": "#/$defs/payloadRef" }
    },
    "processingMetadata": {
      "type": "object",
      "additionalProperties": false,
      "properties": {
        "startedAt": { "type": "string", "format": "date-time" },
        "completedAt": { "type": "string", "format": "date-time" },
        "durationMs": { "type": "integer", "minimum": 0 },
        "tokenUsage": {
          "type": "object",
          "additionalProperties": false,
          "properties": {
            "input": { "type": "integer", "minimum": 0 },
            "output": { "type": "integer", "minimum": 0 },
            "total": { "type": "integer", "minimum": 0 },
            "cached": { "type": "integer", "minimum": 0 }
          }
        },
        "stopReason": { "type": "string" },
        "providerRequestId": { "type": "string" }
      }
    },
    "policyMetadata": {
      "type": "object",
      "additionalProperties": false,
      "description": "Applied policies, redactions, and content filters at the time of the call.",
      "properties": {
        "redactionApplied": { "type": "boolean" },
        "redactionPolicy": { "type": "string", "description": "Identifier of the redaction policy applied (e.g. 'pii-redaction-v3')." },
        "contentFilters": {
          "type": "array",
          "items": { "type": "string" }
        },
        "consent": {
          "type": "object",
          "additionalProperties": false,
          "properties": {
            "scope": { "type": "string" },
            "obtainedAt": { "type": "string", "format": "date-time" },
            "reference": { "type": "string" }
          }
        }
      }
    },
    "integrity": {
      "type": "object",
      "additionalProperties": false,
      "required": ["canonicalization", "envelopeHash"],
      "properties": {
        "canonicalization": {
          "type": "string",
          "enum": ["RFC8785"],
          "description": "Canonicalization scheme used. v1 supports only RFC 8785 (JCS)."
        },
        "envelopeHash": {
          "$ref": "#/$defs/contentHash",
          "description": "Hash of the canonical envelope with the integrity.envelopeHash and proofs fields *removed* before canonicalization. See spec/README.md."
        }
      }
    },
    "proofs": {
      "type": "array",
      "description": "Cryptographic proofs over the envelopeHash. v1 supports RFC 3161 timestamp tokens. Multiple proofs MAY be present (e.g. timestamp chain, future signatures).",
      "items": {
        "oneOf": [
          { "$ref": "#/$defs/proofRfc3161" }
        ]
      }
    }
  },
  "$defs": {
    "contentHash": {
      "type": "object",
      "additionalProperties": false,
      "required": ["alg", "hex"],
      "properties": {
        "alg": {
          "type": "string",
          "enum": ["SHA-256", "SHA-384", "SHA-512"],
          "description": "Hash algorithm. SHA-256 is the default; SHA-512 is supported for parity with Sigill auto-TSA."
        },
        "hex": {
          "type": "string",
          "pattern": "^[0-9a-f]+$",
          "description": "Lowercase hex-encoded digest."
        },
        "sizeBytes": {
          "type": "integer",
          "minimum": 0,
          "description": "Optional: size of the input bytes that were hashed."
        }
      }
    },
    "payloadRef": {
      "type": "object",
      "additionalProperties": false,
      "description": "A payload represented either inline (small, non-sensitive) or by hash reference (sensitive or large). Exactly one of 'inline' or 'hash' MUST be present.",
      "properties": {
        "ref": {
          "type": "string",
          "description": "Stable identifier the verifier uses to look up the external payload bytes. REQUIRED when 'hash' is set."
        },
        "contentType": {
          "type": "string",
          "description": "MIME type of the underlying payload (e.g. 'text/plain', 'application/json')."
        },
        "encoding": {
          "type": "string",
          "enum": ["utf-8", "base64", "binary"],
          "description": "How the payload was encoded prior to hashing. 'utf-8' for text, 'base64' if you want to record it verbatim inline, 'binary' for files."
        },
        "inline": {
          "description": "The payload itself, included verbatim. ONLY use for non-PII content. Mutually exclusive with 'hash'."
        },
        "hash": {
          "$ref": "#/$defs/contentHash",
          "description": "Hash of the external payload. Mutually exclusive with 'inline'."
        },
        "metadata": {
          "type": "object",
          "description": "Optional structured metadata about the payload (length, language, role, ...)."
        }
      },
      "oneOf": [
        { "required": ["inline"] },
        { "required": ["hash", "ref"] }
      ]
    },
    "proofRfc3161": {
      "type": "object",
      "additionalProperties": false,
      "required": ["type", "tsrBase64"],
      "properties": {
        "type": {
          "type": "string",
          "const": "rfc3161"
        },
        "tsrBase64": {
          "type": "string",
          "description": "Base64-encoded RFC 3161 TimeStampToken (TSR) over integrity.envelopeHash.hex."
        },
        "tsaName": {
          "type": "string",
          "description": "Human-readable name of the TSA that produced this proof, as reported by Sigill."
        },
        "genTime": {
          "type": "string",
          "format": "date-time",
          "description": "TSA-asserted time, copied from the TSR for convenience. Authoritative value lives inside tsrBase64."
        },
        "serial": {
          "type": "string",
          "description": "TSR serial number, copied for convenience."
        },
        "qualified": {
          "type": "boolean",
          "description": "Whether this is an eIDAS Qualified timestamp."
        },
        "policyOid": {
          "type": "string",
          "description": "Policy OID asserted by the TSA, present for qualified timestamps."
        }
      }
    }
  }
}
